{"$schema":"https://json-schema.org/draft/2020-12/schema","$id":"https://example.invalid/aster-demo-1.schema.json","title":"Aster demo review pack input","type":"object","additionalProperties":false,"required":["schemaVersion","document","policy","purchaseOrder","receipts","invoices","ingestionEvents"],"properties":{"schemaVersion":{"const":"aster-demo-1"},"document":{"type":"object","additionalProperties":false,"required":["id","title","asOfDate","currency","buyer","supplier","notice"],"properties":{"id":{"type":"string","minLength":1},"title":{"type":"string","minLength":1},"asOfDate":{"type":"string","minLength":1},"currency":{"const":"SGD"},"buyer":{"type":"string","minLength":1},"supplier":{"type":"string","minLength":1},"notice":{"type":"string","minLength":1}}},"policy":{"type":"object","additionalProperties":false,"required":["priceToleranceCents","quantityToleranceUnits","matchRule","duplicateRule","taxMode","quantityMode"],"properties":{"priceToleranceCents":{"const":0},"quantityToleranceUnits":{"const":0},"matchRule":{"const":"EXPLICIT_PO_LINE_ID_ONLY"},"duplicateRule":{"const":"REPEATED_SOURCE_RECORD_KEY_IS_REVIEW_ONLY"},"taxMode":{"const":"EXCLUDED_FROM_DEMO"},"quantityMode":{"const":"INTEGER_EA"}}},"purchaseOrder":{"type":"object","additionalProperties":false,"required":["id","orderDate","lines"],"properties":{"id":{"type":"string","minLength":1},"orderDate":{"type":"string","minLength":1},"lines":{"type":"array","items":{"type":"object","additionalProperties":false,"required":["id","sku","description","orderedQty","uom","unitPriceCents"],"properties":{"id":{"type":"string","minLength":1},"sku":{"type":"string","minLength":1},"description":{"type":"string","minLength":1},"orderedQty":{"type":"integer","minimum":0,"maximum":9007199254740991},"uom":{"const":"EA"},"unitPriceCents":{"type":"integer","minimum":0,"maximum":9007199254740991}}}}}},"receipts":{"type":"array","items":{"type":"object","additionalProperties":false,"required":["id","receivedDate","lines"],"properties":{"id":{"type":"string","minLength":1},"receivedDate":{"type":"string","minLength":1},"lines":{"type":"array","items":{"type":"object","additionalProperties":false,"required":["id","poLineId","receivedQty","returnedQty","returnReference"],"properties":{"id":{"type":"string","minLength":1},"poLineId":{"type":"string","minLength":1},"receivedQty":{"type":"integer","minimum":0,"maximum":9007199254740991},"returnedQty":{"type":"integer","minimum":0,"maximum":9007199254740991},"returnReference":{"type":["string","null"]}}}}}}},"invoices":{"type":"array","items":{"type":"object","additionalProperties":false,"required":["id","invoiceDate","lines"],"properties":{"id":{"type":"string","minLength":1},"invoiceDate":{"type":"string","minLength":1},"lines":{"type":"array","items":{"type":"object","additionalProperties":false,"required":["id","poLineId","sku","description","billedQty","uom","unitPriceCents"],"properties":{"id":{"type":"string","minLength":1},"poLineId":{"type":["string","null"]},"sku":{"type":"string","minLength":1},"description":{"type":"string","minLength":1},"billedQty":{"type":"integer","minimum":0,"maximum":9007199254740991},"uom":{"const":"EA"},"unitPriceCents":{"type":"integer","minimum":0,"maximum":9007199254740991}}}}}}},"ingestionEvents":{"type":"array","items":{"type":"object","additionalProperties":false,"required":["id","invoiceId","invoiceLineId","sourceRecordKey"],"properties":{"id":{"type":"string","minLength":1},"invoiceId":{"type":"string","minLength":1},"invoiceLineId":{"type":"string","minLength":1},"sourceRecordKey":{"type":"string","minLength":1}}}}}}
