{"schemaVersion":"aster-demo-1","document":{"id":"ASTER-REVIEW-DEMO-001","title":"Three-Way Match Review Pack","asOfDate":"2026-09-30","currency":"SGD","buyer":"Aster Components Demo","supplier":"Copperline Supplies Demo","notice":"SAMPLE — fictional review data. Not an approval, payment instruction or audit opinion."},"policy":{"priceToleranceCents":0,"quantityToleranceUnits":0,"matchRule":"EXPLICIT_PO_LINE_ID_ONLY","duplicateRule":"REPEATED_SOURCE_RECORD_KEY_IS_REVIEW_ONLY","taxMode":"EXCLUDED_FROM_DEMO","quantityMode":"INTEGER_EA"},"purchaseOrder":{"id":"PO-DEMO-001","orderDate":"2026-09-10","lines":[{"id":"POL-001","sku":"AST-001","description":"Cable management tray","orderedQty":10,"uom":"EA","unitPriceCents":1125},{"id":"POL-002","sku":"AST-002","description":"Bench mounting bracket","orderedQty":10,"uom":"EA","unitPriceCents":1250},{"id":"POL-003","sku":"AST-003","description":"Precision spacer set","orderedQty":10,"uom":"EA","unitPriceCents":1375},{"id":"POL-004","sku":"AST-004","description":"Protective panel insert","orderedQty":10,"uom":"EA","unitPriceCents":1500},{"id":"POL-005","sku":"AST-005","description":"Connector housing kit","orderedQty":10,"uom":"EA","unitPriceCents":1625},{"id":"POL-006","sku":"AST-006","description":"Instrument support rail","orderedQty":10,"uom":"EA","unitPriceCents":1750},{"id":"POL-007","sku":"AST-007","description":"Label carrier strip","orderedQty":10,"uom":"EA","unitPriceCents":1875},{"id":"POL-008","sku":"AST-008","description":"Terminal cover plate","orderedQty":10,"uom":"EA","unitPriceCents":2000},{"id":"POL-009","sku":"AST-009","description":"Mounting foot assembly","orderedQty":10,"uom":"EA","unitPriceCents":2125},{"id":"POL-010","sku":"AST-010","description":"Control knob set","orderedQty":10,"uom":"EA","unitPriceCents":2250},{"id":"POL-011","sku":"AST-011","description":"Enclosure hinge pair","orderedQty":10,"uom":"EA","unitPriceCents":2375},{"id":"POL-012","sku":"AST-012","description":"Fan guard panel","orderedQty":10,"uom":"EA","unitPriceCents":2500},{"id":"POL-013","sku":"AST-013","description":"Cable entry gland","orderedQty":10,"uom":"EA","unitPriceCents":2625},{"id":"POL-014","sku":"AST-014","description":"DIN rail adapter","orderedQty":10,"uom":"EA","unitPriceCents":2750},{"id":"POL-015","sku":"AST-015","description":"Display bezel frame","orderedQty":10,"uom":"EA","unitPriceCents":2875},{"id":"POL-016","sku":"AST-016","description":"Panel fastener pack","orderedQty":10,"uom":"EA","unitPriceCents":3000},{"id":"POL-017","sku":"AST-017","description":"Insulating sleeve set","orderedQty":10,"uom":"EA","unitPriceCents":3125},{"id":"POL-018","sku":"AST-018","description":"Service access cover","orderedQty":10,"uom":"EA","unitPriceCents":3250},{"id":"POL-019","sku":"AST-019","description":"Sensor mounting clip","orderedQty":10,"uom":"EA","unitPriceCents":3375},{"id":"POL-020","sku":"AST-020","description":"Grounding stud kit","orderedQty":10,"uom":"EA","unitPriceCents":3500},{"id":"POL-021","sku":"AST-021","description":"Seal retaining ring","orderedQty":10,"uom":"EA","unitPriceCents":3625},{"id":"POL-022","sku":"AST-022","description":"Terminal marker pack","orderedQty":10,"uom":"EA","unitPriceCents":3750},{"id":"POL-023","sku":"AST-023","description":"Equipment handle pair","orderedQty":10,"uom":"EA","unitPriceCents":3875},{"id":"POL-024","sku":"AST-024","description":"Inspection window frame","orderedQty":10,"uom":"EA","unitPriceCents":4000}]},"receipts":[{"id":"GR-DEMO-001","receivedDate":"2026-09-12","lines":[{"id":"R1L-001","poLineId":"POL-001","receivedQty":10,"returnedQty":0,"returnReference":null},{"id":"R1L-002","poLineId":"POL-002","receivedQty":10,"returnedQty":0,"returnReference":null},{"id":"R1L-003","poLineId":"POL-003","receivedQty":6,"returnedQty":0,"returnReference":null},{"id":"R1L-004","poLineId":"POL-004","receivedQty":10,"returnedQty":0,"returnReference":null},{"id":"R1L-006","poLineId":"POL-006","receivedQty":10,"returnedQty":0,"returnReference":null},{"id":"R1L-007","poLineId":"POL-007","receivedQty":10,"returnedQty":0,"returnReference":null},{"id":"R1L-008","poLineId":"POL-008","receivedQty":10,"returnedQty":0,"returnReference":null}]},{"id":"GR-DEMO-002","receivedDate":"2026-09-15","lines":[{"id":"R2L-009","poLineId":"POL-009","receivedQty":10,"returnedQty":0,"returnReference":null},{"id":"R2L-010","poLineId":"POL-010","receivedQty":10,"returnedQty":0,"returnReference":null},{"id":"R2L-011","poLineId":"POL-011","receivedQty":10,"returnedQty":0,"returnReference":null},{"id":"R2L-012","poLineId":"POL-012","receivedQty":10,"returnedQty":0,"returnReference":null},{"id":"R2L-013","poLineId":"POL-013","receivedQty":10,"returnedQty":0,"returnReference":null},{"id":"R2L-014","poLineId":"POL-014","receivedQty":10,"returnedQty":0,"returnReference":null},{"id":"R2L-015","poLineId":"POL-015","receivedQty":10,"returnedQty":0,"returnReference":null},{"id":"R2L-016","poLineId":"POL-016","receivedQty":10,"returnedQty":0,"returnReference":null}]},{"id":"GR-DEMO-003","receivedDate":"2026-09-18","lines":[{"id":"R3L-017","poLineId":"POL-017","receivedQty":10,"returnedQty":0,"returnReference":null},{"id":"R3L-018","poLineId":"POL-018","receivedQty":10,"returnedQty":2,"returnReference":"RET-DEMO-018"},{"id":"R3L-019","poLineId":"POL-019","receivedQty":10,"returnedQty":0,"returnReference":null},{"id":"R3L-020","poLineId":"POL-020","receivedQty":10,"returnedQty":0,"returnReference":null},{"id":"R3L-021","poLineId":"POL-021","receivedQty":10,"returnedQty":0,"returnReference":null},{"id":"R3L-022","poLineId":"POL-022","receivedQty":10,"returnedQty":0,"returnReference":null},{"id":"R3L-023","poLineId":"POL-023","receivedQty":10,"returnedQty":0,"returnReference":null},{"id":"R3L-024","poLineId":"POL-024","receivedQty":10,"returnedQty":0,"returnReference":null}]}],"invoices":[{"id":"INV-DEMO-001","invoiceDate":"2026-09-22","lines":[{"id":"IL-001","poLineId":"POL-001","sku":"AST-001","description":"Cable management tray","billedQty":10,"uom":"EA","unitPriceCents":1125},{"id":"IL-002","poLineId":"POL-002","sku":"AST-002","description":"Bench mounting bracket","billedQty":10,"uom":"EA","unitPriceCents":1350},{"id":"IL-003","poLineId":"POL-003","sku":"AST-003","description":"Precision spacer set","billedQty":8,"uom":"EA","unitPriceCents":1375},{"id":"IL-004","poLineId":"POL-004","sku":"AST-004","description":"Protective panel insert","billedQty":10,"uom":"EA","unitPriceCents":1500},{"id":"IL-005","poLineId":"POL-005","sku":"AST-005","description":"Connector housing kit","billedQty":2,"uom":"EA","unitPriceCents":1625},{"id":"IL-006","poLineId":"POL-006","sku":"AST-006","description":"Instrument support rail","billedQty":10,"uom":"EA","unitPriceCents":1750},{"id":"IL-007","poLineId":null,"sku":"AST-007","description":"Label carrier strip","billedQty":10,"uom":"EA","unitPriceCents":1875},{"id":"IL-008","poLineId":"POL-008","sku":"AST-008","description":"Terminal cover plate","billedQty":10,"uom":"EA","unitPriceCents":2000},{"id":"IL-009","poLineId":"POL-009","sku":"AST-009","description":"Mounting foot assembly","billedQty":10,"uom":"EA","unitPriceCents":2125},{"id":"IL-010","poLineId":"POL-010","sku":"AST-010","description":"Control knob set","billedQty":10,"uom":"EA","unitPriceCents":2250},{"id":"IL-011","poLineId":"POL-011","sku":"AST-011","description":"Enclosure hinge pair","billedQty":10,"uom":"EA","unitPriceCents":2375},{"id":"IL-012","poLineId":"POL-012","sku":"AST-012","description":"Fan guard panel","billedQty":10,"uom":"EA","unitPriceCents":2500}]},{"id":"INV-DEMO-002","invoiceDate":"2026-09-23","lines":[{"id":"IL-013","poLineId":"POL-013","sku":"AST-013","description":"Cable entry gland","billedQty":10,"uom":"EA","unitPriceCents":2625},{"id":"IL-014","poLineId":"POL-014","sku":"AST-014","description":"DIN rail adapter","billedQty":10,"uom":"EA","unitPriceCents":2750},{"id":"IL-015","poLineId":"POL-015","sku":"AST-015","description":"Display bezel frame","billedQty":10,"uom":"EA","unitPriceCents":2875},{"id":"IL-016","poLineId":"POL-016","sku":"AST-016","description":"Panel fastener pack","billedQty":10,"uom":"EA","unitPriceCents":3000},{"id":"IL-017","poLineId":"POL-017","sku":"AST-017","description":"Insulating sleeve set","billedQty":10,"uom":"EA","unitPriceCents":3125},{"id":"IL-018","poLineId":"POL-018","sku":"AST-018","description":"Service access cover","billedQty":10,"uom":"EA","unitPriceCents":3250},{"id":"IL-019","poLineId":"POL-019","sku":"AST-019","description":"Sensor mounting clip","billedQty":10,"uom":"EA","unitPriceCents":3375},{"id":"IL-020","poLineId":"POL-020","sku":"AST-020","description":"Grounding stud kit","billedQty":10,"uom":"EA","unitPriceCents":3500},{"id":"IL-021","poLineId":"POL-021","sku":"AST-021","description":"Seal retaining ring","billedQty":10,"uom":"EA","unitPriceCents":3625},{"id":"IL-022","poLineId":"POL-022","sku":"AST-022","description":"Terminal marker pack","billedQty":10,"uom":"EA","unitPriceCents":3750},{"id":"IL-023","poLineId":"POL-023","sku":"AST-023","description":"Equipment handle pair","billedQty":10,"uom":"EA","unitPriceCents":3875},{"id":"IL-024","poLineId":"POL-024","sku":"AST-024","description":"Inspection window frame","billedQty":10,"uom":"EA","unitPriceCents":4000}]}],"ingestionEvents":[{"id":"EVT-001","invoiceId":"INV-DEMO-001","invoiceLineId":"IL-001","sourceRecordKey":"SRC-IL-001"},{"id":"EVT-002","invoiceId":"INV-DEMO-001","invoiceLineId":"IL-002","sourceRecordKey":"SRC-IL-002"},{"id":"EVT-003","invoiceId":"INV-DEMO-001","invoiceLineId":"IL-003","sourceRecordKey":"SRC-IL-003"},{"id":"EVT-004","invoiceId":"INV-DEMO-001","invoiceLineId":"IL-004","sourceRecordKey":"SRC-IL-004"},{"id":"EVT-005","invoiceId":"INV-DEMO-001","invoiceLineId":"IL-005","sourceRecordKey":"SRC-IL-005"},{"id":"EVT-006","invoiceId":"INV-DEMO-001","invoiceLineId":"IL-006","sourceRecordKey":"SRC-IL-006"},{"id":"EVT-007","invoiceId":"INV-DEMO-001","invoiceLineId":"IL-007","sourceRecordKey":"SRC-IL-007"},{"id":"EVT-008","invoiceI